{
  "manifest": {
    "format_version": "0.2",
    "name": "synthetic-glacier-mini",
    "created_at": "2026-06-29T00:00:00Z",
    "producer": "hmx-spec-example",
    "producer_version": "0.1.2",
    "package_kind": "input",
    "crs": "EPSG:32645"
  },
  "content_hash": { "algo": "sha256", "value": "3333333333333333333333333333333333333333333333333333333333333333" },
  "crs": "EPSG:32645",
  "grid": {
    "crs": "EPSG:32645",
    "extent": { "xmin": 0.0, "ymin": 0.0, "xmax": 1000.0, "ymax": 1000.0 },
    "cell_size": 250.0,
    "nx": 4,
    "ny": 4,
    "origin": "upper_left"
  },
  "domains": [
    { "id": "cell", "entity_count": 16, "index_base": "dense_zero_based", "external_id_count": null },
    { "id": "glacier", "entity_count": 3, "index_base": "dense_zero_based", "external_id_count": 3 }
  ],
  "fields": [
    { "id": "glacier.ice_volume_m3", "domain": "glacier", "quantity": "volume", "units": "m3", "value_type": "f64", "time_meaning": "instant", "role": "differential_state", "conservation_class": "water_volume", "extent": "scalar" }
  ],
  "mappings": [
    { "purpose": "cell_to_glacier", "source_domain": "cell", "target_domain": "glacier", "variable": null, "artifact_role": "mapping.cell_to_glacier" }
  ],
  "artifacts": [
    { "role": "static.flow_dir", "path": "static/flow_dir.tif", "format": "cog", "sha256": "1111111111111111111111111111111111111111111111111111111111111111", "size_bytes": 2498 }
  ]
}
