{"manifest":{"format_version":"0.2","name":"minimal","created_at":"2026-06-29T00:00:00Z","producer":"hmx-fixtures","producer_version":"0.1.0","package_kind":"input","crs":"EPSG:32645"},"content_hash":{"algo":"sha256","value":"ff208e50e11199f7dea1b28fb895acef92bd2bcb5e8081859ab646e4178ad346"},"crs":"EPSG:32645","grid":{"crs":"EPSG:32645","extent":{"xmin":0.0,"ymin":0.0,"xmax":1000.0,"ymax":1000.0},"cell_size":250.0,"nx":2,"ny":2,"origin":"upper_left"},"domains":[{"id":"cell","entity_count":4,"index_base":"dense_zero_based","external_id_count":null},{"id":"glacier","entity_count":3,"index_base":"dense_zero_based","external_id_count":3}],"fields":[{"id":"glacier.thickness_m_we","domain":"glacier","quantity":"thickness","units":"m w.e.","value_type":"f64","time_meaning":"instant","role":"parameter","conservation_class":"none","extent":"scalar"}],"mappings":[{"purpose":"cell_to_glacier","source_domain":"cell","target_domain":"glacier","variable":null,"artifact_role":"mapping.cell_to_glacier"}],"artifacts":[{"role":"registry.fields","path":"registry/fields.json","format":"hmx/field_registry_v1","sha256":"0000000000000000000000000000000000000000000000000000000000000000","size_bytes":512},{"role":"static.dem","path":"static/dem.tif","format":"cog","sha256":"4444444444444444444444444444444444444444444444444444444444444444","size_bytes":1024},{"role":"mapping.cell_to_glacier","path":"mappings/cell_to_glacier.parquet","format":"parquet/domain_mapping_v1","sha256":"1111111111111111111111111111111111111111111111111111111111111111","size_bytes":2498},{"role":"attributes.glacier","path":"attributes/glacier.parquet","format":"parquet/domain_attributes_v1","sha256":"2222222222222222222222222222222222222222222222222222222222222222","size_bytes":2498},{"role":"forcing.flow","path":"forcing/flow.zarr","format":"zarr","sha256":"3333333333333333333333333333333333333333333333333333333333333333","size_bytes":1024}]}
