{"manifest":{"format_version":"0.2","name":"parameter-scalars","created_at":"2026-06-29T00:00:00Z","producer":"hmx-fixtures","producer_version":"0.1.0","package_kind":"input","crs":"EPSG:32645"},"content_hash":{"algo":"sha256","value":"213b3546398c467494b8bc3ddec7b48f0e949cf99ab0515346a3f3a9101a3e13"},"crs":"EPSG:32645","grid":{"crs":"EPSG:32645","extent":{"xmin":0.0,"ymin":0.0,"xmax":1000.0,"ymax":1000.0},"cell_size":250.0,"nx":2,"ny":2,"origin":"upper_left"},"domains":[{"id":"cell","entity_count":1,"index_base":"dense_zero_based","external_id_count":null}],"fields":[{"id":"cell.air_temperature_c","domain":"cell","quantity":"air_temperature","units":"degC","value_type":"f64","time_meaning":"instant","role":"forcing","conservation_class":"none","extent":"scalar"},{"id":"cell.snow_melt_threshold_c","domain":"cell","quantity":"snow_melt_threshold","units":"degC","value_type":"f64","time_meaning":"instant","role":"parameter","conservation_class":"none","extent":"scalar"},{"id":"cell.soil_layer_capacity_mm","domain":"cell","quantity":"soil_layer_capacity","units":"mm","value_type":"f64","time_meaning":"instant","role":"parameter","conservation_class":"none","extent":"per_layer"},{"id":"cell.spatial_coefficient","domain":"cell","quantity":"spatial_coefficient","units":"1","value_type":"f64","time_meaning":"instant","role":"parameter","conservation_class":"none","extent":"scalar"}],"mappings":[],"artifacts":[{"role":"registry.fields","path":"registry/fields.json","format":"hmx/field_registry_v1","sha256":"0000000000000000000000000000000000000000000000000000000000000000","size_bytes":512},{"role":"parameter.scalars","path":"parameter/scalars.json","format":"hmx/parameter_scalars_v1","sha256":"bbbbbbbbbbbbbbbbbbbbbbbbbbbbbbbbbbbbbbbbbbbbbbbbbbbbbbbbbbbbbbbb","size_bytes":512},{"role":"parameter.spatial_coefficient","path":"parameter/spatial_coefficient.tif","format":"cog","sha256":"cccccccccccccccccccccccccccccccccccccccccccccccccccccccccccccccc","size_bytes":1024}]}
