{"manifest":{"format_version":"0.2","name":"real-shape-basin","created_at":"2026-06-29T00:00:00Z","producer":"hmx-fixtures","producer_version":"0.1.0","package_kind":"input","crs":"EPSG:32645"},"content_hash":{"algo":"sha256","value":"cbeacd2cf9399344cbec875e33f1cf8c7bc77f91412b81362e50bd53b5e2f2f8"},"crs":"EPSG:32645","grid":{"crs":"EPSG:32645","extent":{"xmin":0.0,"ymin":0.0,"xmax":1000.0,"ymax":1000.0},"cell_size":250.0,"nx":2,"ny":2,"origin":"upper_left"},"domains":[{"id":"cell","entity_count":4,"index_base":"dense_zero_based","external_id_count":null},{"id":"reach","entity_count":2,"index_base":"dense_zero_based","external_id_count":null},{"id":"gauge","entity_count":2,"index_base":"dense_zero_based","external_id_count":null},{"id":"glacier","entity_count":3,"index_base":"dense_zero_based","external_id_count":3}],"fields":[{"id":"gauge.discharge","domain":"gauge","quantity":"discharge","units":"m3 s-1","value_type":"f64","time_meaning":"rate","role":"forcing","conservation_class":"water_volume","extent":"scalar"},{"id":"glacier.thickness_m_we","domain":"glacier","quantity":"thickness","units":"m w.e.","value_type":"f64","time_meaning":"instant","role":"parameter","conservation_class":"none","extent":"scalar"}],"mappings":[{"purpose":"cell_to_reach","source_domain":"cell","target_domain":"reach","variable":null,"artifact_role":"mapping.cell_to_reach"},{"purpose":"cell_to_gauge","source_domain":"cell","target_domain":"gauge","variable":"gauge.discharge","artifact_role":"mapping.cell_to_gauge"},{"purpose":"cell_to_glacier","source_domain":"cell","target_domain":"glacier","variable":null,"artifact_role":"mapping.cell_to_glacier"}],"artifacts":[{"role":"registry.fields","path":"registry/fields.json","format":"hmx/field_registry_v1","sha256":"0000000000000000000000000000000000000000000000000000000000000000","size_bytes":512},{"role":"static.dem","path":"static/dem.tif","format":"cog","sha256":"4444444444444444444444444444444444444444444444444444444444444444","size_bytes":1024},{"role":"static.layers","path":"static/layers.tif","format":"cog","sha256":"aaaaaaaaaaaaaaaaaaaaaaaaaaaaaaaaaaaaaaaaaaaaaaaaaaaaaaaaaaaaaaaa","size_bytes":1024},{"role":"mapping.cell_to_reach","path":"mappings/cell_to_reach.parquet","format":"parquet/cell_to_reach_v1","sha256":"5555555555555555555555555555555555555555555555555555555555555555","size_bytes":2498},{"role":"attributes.reach","path":"topology/reaches.parquet","format":"geoparquet/reach_topology_v1","sha256":"7777777777777777777777777777777777777777777777777777777777777777","size_bytes":2498},{"role":"mapping.cell_to_gauge","path":"mappings/cell_to_gauge.parquet","format":"parquet/cell_to_gauge_v1","sha256":"6666666666666666666666666666666666666666666666666666666666666666","size_bytes":2498},{"role":"forcing.gauge","path":"forcing/gauge_long.parquet","format":"parquet/gauge_long_v1","sha256":"8888888888888888888888888888888888888888888888888888888888888888","size_bytes":2498},{"role":"metadata.gauge","path":"metadata/gauge.parquet","format":"parquet/gauge_metadata_v1","sha256":"9999999999999999999999999999999999999999999999999999999999999999","size_bytes":2498},{"role":"mapping.cell_to_glacier","path":"mappings/cell_to_glacier.parquet","format":"parquet/domain_mapping_v1","sha256":"1111111111111111111111111111111111111111111111111111111111111111","size_bytes":2498},{"role":"attributes.glacier","path":"attributes/glacier.parquet","format":"parquet/domain_attributes_v1","sha256":"2222222222222222222222222222222222222222222222222222222222222222","size_bytes":2498}]}
